{
  "schema_version": "1.0.0",
  "task_id": "gateway-status-shortcut-false-completion",
  "objective": "Repair the Founder Command Center gateway defect that collapses a structured multi-requirement objective into a canned deterministic report and marks it terminal state completed. RE-SCOPED AND SURVEYED 2026-08-12 against Command Center dd9b222. Verified: scripts/local-gateway.mjs has exactly one deterministic shortcut return, at lines 3311 to 3324, serving three triggers — showCapabilities, showStatus, and emergencyStop — and all three emit terminal state completed. IRIS Core now rejects any caller-asserted completed with OPERATING_OBJECTIVE_TERMINAL_COMPLETION_NOT_ASSERTABLE, so all three break once that repair merges, not only status. The emergency-stop effect itself survives, because deleteOperatorEntry and deleteDesktopControlEntry run at lines 3608 to 3611 before objective construction; what breaks is the Founder's acknowledgement, which is a real hazard on a safety path because the operator cannot tell whether the stop took effect. Root design flaw: the shortcut stuffs canned text into terminal.evidence and controllerReply at line 3417 renders it back, so completion state is being used as a transport for presentation. The repair must stop every shortcut from emitting completed, keep the emergency-stop acknowledgement working, narrow the classification so a structured objective never short-circuits, and let a genuine bare status or capability request either reach normal objective construction or be rendered locally. The existing rendering path at line 3617 already carries show-status, show-capabilities, and emergency-stop intents and is the natural seam. PRECONDITION: produce and verify against a Core revision containing the terminal repair. Coordination records and evidence live in IRIS Core; gateway sources and tests live in the Command Center.",
  "issuer": "Founder Cristofer Stoic Arellano",
  "executor": "Claude",
  "assigned_role": "producer",
  "created_at": "2026-08-12T00:44:06.0000000Z",
  "status": "approved",
  "risk_class": "R2",
  "authorization_mode": "single_action",
  "completion_mandate_text": null,
  "completion_actions": [],
  "completion_exclusions": [
    "No change to the seven certification tests, their pass conditions, or the recorded Test One failure",
    "No change to the canonical operating contract, its digest, the five decision outcomes, or protected-effect boundaries",
    "No change to IRIS Core, including the terminal repair this task depends on",
    "No weakening of fail-closed behavior, secret filtering, approval consumption, protected-path enforcement, or the emergency-stop path",
    "No Phase 0 graduation execution, approval, or completion claim"
  ],
  "base_revisions": [
    {
      "repository": "stoic1712-IRIS/IRIS",
      "branch": "main",
      "commit": "08f69f82846e40d1a428f4238da5f14918965fa1"
    },
    {
      "repository": "stoic1712-IRIS/iris-founder-command-center",
      "branch": "main",
      "commit": "dd9b22218ef10456851bdef06c38913e415bcd6f"
    }
  ],
  "allowed_paths": [
    ".iris/coordination/tasks/gateway-status-shortcut-false-completion.json",
    ".iris/coordination/handoffs/gateway-status-shortcut-false-completion.json",
    "evidence/gateway-repair/status-shortcut-false-completion.md",
    "scripts/local-gateway.mjs",
    "tests/local-gateway.test.ts"
  ],
  "excluded_paths": [
    ".github/**",
    ".claude/**",
    "config/iris-operating-contract.v1.json",
    "docs/governance/**",
    "docs/operations/cycle-twelve-founder-certification-program.md",
    "docs/registries/**",
    "evidence/cycle-twelve/**",
    "generated/**",
    "packages/**",
    "tests/operating-decision-engine.test.ts",
    "C:/Projects/STOIC-IRIS-source-library/**"
  ],
  "permitted_actions": [
    "Stop every deterministic shortcut from emitting terminal state completed, so no shortcut can assert completion for any request, addressed or not",
    "Preserve the Founder-visible emergency-stop acknowledgement, either by rendering it in the gateway at the existing line 3617 seam or by emitting a non-success terminal state such as cancelled, which IRIS Core still accepts from a caller; state the chosen approach and its rationale",
    "Stop using terminal.evidence as a transport for canned presentation text, so completion state and displayed text are no longer the same channel",
    "Narrow the shortcut classification so it fires only for a genuine short unstructured status, capability, or emergency-stop request, and not for a structured objective that carries enumerated requirements or explicit constraints",
    "For a genuine bare status or capability request, either route it through normal objective construction, capability evaluation, and model routing, or render the answer in the gateway without asking Core to declare a terminal state; state the chosen approach and its rationale",
    "Add regression tests in tests/local-gateway.test.ts covering at minimum: a structured multi-item objective containing the token status does not short-circuit; a bare status request still returns a useful answer; no shortcut path emits completed; and an emergency stop still both revokes access and returns a Founder-visible acknowledgement",
    "Report any change that would require a path outside allowed_paths rather than silently expanding scope"
  ],
  "prohibited_actions": [
    "Delete or weaken an existing test, guard, fail-closed path, or governance control to make the repair pass",
    "Weaken, delay, reorder, or bypass the emergency-stop revocation at lines 3608 to 3611 in order to satisfy the no-completed rule",
    "Leave the emergency stop without a Founder-visible acknowledgement; a silent or error-only stop is not an acceptable outcome on a safety path",
    "Modify IRIS Core, the operating contract, the certification program, or the recorded Test One failure evidence",
    "Reintroduce a caller-asserted completed anywhere, including through a new code path, a default value, or a wrapper",
    "Produce or verify this repair against a Core revision that lacks the terminal repair",
    "Force-push, rewrite history, bypass branch protection, administer repositories, or use broad staging",
    "Claim the repair certifies Test One; it only permits a fresh Test One attempt from a new exact proposal"
  ],
  "acceptance_commands": [
    {
      "repository": "stoic1712-IRIS/iris-founder-command-center",
      "command": "pnpm exec vitest run tests/local-gateway.test.ts"
    },
    {
      "repository": "stoic1712-IRIS/iris-founder-command-center",
      "command": "pnpm verify"
    },
    {
      "repository": "stoic1712-IRIS/IRIS",
      "command": "pnpm verify"
    }
  ],
  "required_evidence": [
    "Exact reproduction of the pre-repair misclassification and its absence after the repair",
    "A survey confirming every deterministic shortcut, its trigger, and the terminal state it emitted before and after, including confirmation that the single return at lines 3311 to 3324 no longer emits completed for any of its three triggers",
    "Proof that an emergency stop still revokes operator and desktop-control access and still returns a Founder-visible acknowledgement, demonstrated against a Core revision containing the terminal repair",
    "Proof that a genuine bare status or capability request still returns a useful answer under the chosen approach",
    "A regression test that fails against the pre-repair gateway and passes after it",
    "An end-to-end demonstration that the exact Test One objective wording now reaches objective construction rather than a canned report, with the Core revision named",
    "Confirmation that the canonical operating contract digest, the five decision outcomes, and protected-effect boundaries are unchanged",
    "Focused and full verification results for both repositories, exact changed paths, limitations, and rollback instructions"
  ],
  "publisher": "Claude, with the Founder as independent reviewer",
  "approval_reference": "founder-gateway-repair-approval-2026-08-12",
  "phase0_graduation": false
}
